{
  "$schema": "https://json-schema.org/draft/2020-12/schema",
  "$id": "https://threading.codes/schema/extension-manifest.schema.json",
  "title": "Threading extension manifest",
  "type": "object",
  "additionalProperties": false,
  "required": [
    "formatVersion",
    "identifier",
    "name",
    "version",
    "runtime",
    "executable",
    "capabilities"
  ],
  "properties": {
    "formatVersion": {
      "const": 1
    },
    "identifier": {
      "type": "string",
      "pattern": "^[a-z][a-z0-9-]*(\\.[a-z][a-z0-9-]*)+$"
    },
    "name": {
      "type": "string",
      "minLength": 1
    },
    "version": {
      "type": "string",
      "minLength": 1
    },
    "dataVersion": {
      "type": "integer",
      "minimum": 1,
      "maximum": 1000000,
      "default": 1,
      "description": "Monotonic schema version for extension-owned settings/KV/cache interpretation. The host commits it only after successful registration."
    },
    "runtime": {
      "type": "string",
      "enum": [
        "native",
        "webAssembly"
      ],
      "description": "Required execution boundary. New distributable Swift extensions should use webAssembly; native must be selected explicitly and is retained only for deprecated compatibility."
    },
    "executable": {
      "type": "string",
      "minLength": 1,
      "description": "Manifest-relative path. Absolute paths and '.' or '..' components are invalid."
    },
    "capabilities": {
      "type": "array",
      "uniqueItems": true,
      "description": "Safe WebAssembly v1 values include commands, panels, mcp.tools, settings, services.provide, services.consume, facts.provide, source-control.read, companions.invoke, ui.components, ui.workspace-navigation, ui.rendering.metal, ui.media-documents, attachments.preview, attachments.file-types, appearance.provider-icons, appearance.account-icons, appearance.session-identity, appearance.themes, appearance.fonts, host.projects.read, host.project.files.read, host.sessions.read, host.sessions.runtime.read, host.repositories.read, host.providers.read, host.accounts.presentation.read, host.events, storage.kv, storage.cache, storage.secrets, network.brokered (paired with explicit networkGrants), and traffic.mock-responses (paired with exact trafficMocks). source-control.read is paired with sourceControlProviders and permits only connection-scoped GET/HEAD requests beneath a declared API prefix; Threading selects the exact HTTPS origin and attaches its Keychain credential. facts.provide publishes bounded scalar facts only against boundary-safe repository domain keys; it grants no project or session read authority. appearance.themes and appearance.fonts are data-plane: the host reads the declared documents and font files itself, and the running extension gains no new broker operation from either. companions.invoke addresses only operations declared by the same extension's companion. ui.workspace-navigation registers semantic navigator documents but grants no additional host-data authority. ui.rendering.metal permits constrained host-owned custom surfaces only; it does not grant Metal objects to the extension process. ui.media-documents permits a `media` node — a document handle plus a playback intent, drawn by a host-owned player; no decoder, surface or pixel reaches the extension. attachments.preview permits offering a preview body for one attachment and grants no attachment read authority: a candidate learns an attachment's name, kind, size, origin and the host's content hint and nothing more. attachments.file-types adds file extensions to the attachments scanner's allow-list and may not claim an extension Threading already classifies. host.project.files.read returns opaque, generation-bound content handles plus bounded filesystem metadata — name, project-relative path, byte size, modification date, content hint — and never bytes or an absolute path; it is not implied by host.projects.read. host.sessions.runtime.read returns only host-attributed process and listening-port rows for an exact session ID; it does not grant process-table access. network.client is reserved for deprecated native compatibility and is rejected for WebAssembly; brokered fetches through networkGrants replace it. Unknown values remain inspectable but are rejected by hosts that do not support them.",
      "items": {
        "type": "string",
        "minLength": 1
      }
    },
    "mcpTools": {
      "type": "array",
      "maxItems": 32,
      "default": [],
      "items": {
        "$ref": "#/$defs/mcpTool"
      }
    },
    "workspaceNavigators": {
      "type": "array",
      "maxItems": 8,
      "uniqueItems": true,
      "default": [],
      "description": "Static host-evaluated navigator declarations. Every value must contain a pipeline and the running generation must register the exact same declaration. Materialized v1 navigators remain runtime-only for compatibility. Requires ui.workspace-navigation.",
      "items": {
        "allOf": [
          { "$ref": "workspace-navigator.schema.json" },
          { "required": ["pipeline"] }
        ]
      }
    },
    "settings": {
      "$ref": "extension-settings.schema.json",
      "default": {
        "pages": [],
        "sections": []
      }
    },
    "services": {
      "type": "array",
      "maxItems": 32,
      "default": [],
      "items": {
        "$ref": "extension-services.schema.json#/$defs/definition"
      }
    },
    "factDefinitions": {
      "type": "array",
      "maxItems": 128,
      "uniqueItems": true,
      "default": [],
      "description": "Domain-keyed scalar facts this process generation may publish. Requires facts.provide.",
      "items": {
        "$ref": "extension-facts.schema.json#/$defs/definition"
      }
    },
    "sourceControlProviders": {
      "type": "array",
      "maxItems": 8,
      "uniqueItems": true,
      "default": [],
      "description": "Read-only hosted-Git adapters. Requires source-control.read and exact manifest/registration parity. Origins and credentials are host-configured, never declared here.",
      "items": {
        "$ref": "extension-source-control.schema.json#/$defs/providerDefinition"
      }
    },
    "serviceDependencies": {
      "type": "array",
      "maxItems": 64,
      "uniqueItems": true,
      "default": [],
      "items": {
        "$ref": "extension-services.schema.json#/$defs/dependency"
      }
    },
    "companions": {
      "type": "array",
      "maxItems": 4,
      "default": [],
      "description": "Optional separately signed macOS worker apps. Companions extend a WebAssembly core; they do not replace its settings, commands, panels, hooks, tools, storage, or host-data capability boundary.",
      "items": {
        "$ref": "#/$defs/companion"
      }
    },
    "networkGrants": {
      "type": "array",
      "maxItems": 8,
      "default": [],
      "description": "Origins the network.brokered capability may fetch from, shown verbatim in the install dialog. Every fetch runs host-side; the guest gains no socket. v1 grants are https-only exact DNS hosts with GET/HEAD. Redirects are followed only when HTTPS, host, method, absent port, and absent user info remain inside that same grant; any other redirect returns its original 3xx for a new independently checked request. A grant naming a credential provider (v1: github) is served with the user's best connected credential — app connection, gh CLI, git credential helper, anonymous — and the response reports which tier answered; tokens never reach the extension. A credentialed grant is refused when the manifest also declares a companion holding network.client.",
      "items": {
        "type": "object",
        "additionalProperties": false,
        "required": ["host", "methods"],
        "properties": {
          "host": {
            "type": "string",
            "minLength": 1,
            "maxLength": 253,
            "description": "Exact lowercase DNS name — no scheme, wildcard, port, or path."
          },
          "methods": {
            "type": "array",
            "minItems": 1,
            "uniqueItems": true,
            "items": {
              "type": "string",
              "enum": ["GET", "HEAD"]
            }
          },
          "credential": {
            "type": "string",
            "enum": ["github"],
            "description": "A host-known credential provider whose connected credential the broker attaches."
          }
        }
      }
    },
    "trafficMocks": {
      "type": "array",
      "maxItems": 8,
      "default": [],
      "description": "Exact HTTP response fixtures used only when traffic_start explicitly names this enabled extension. Requires traffic.mock-responses. Total encoded fixtures may not exceed 48 KiB.",
      "items": {
        "type": "object",
        "additionalProperties": false,
        "required": ["host", "port", "method", "path", "status", "headers", "body"],
        "properties": {
          "host": { "type": "string", "pattern": "^[a-z0-9.-]{1,254}$" },
          "port": { "type": "integer", "minimum": 1, "maximum": 65535 },
          "method": { "type": "string", "pattern": "^[A-Z]{1,16}$" },
          "path": { "type": "string", "pattern": "^/[^\\u0000-\\u0020\\u007f-\\uffff]*$", "maxLength": 4096 },
          "status": { "type": "integer", "minimum": 200, "maximum": 599 },
          "headers": { "type": "object", "maxProperties": 16, "additionalProperties": { "type": "string" } },
          "body": { "type": "string", "description": "At most 4096 UTF-8 bytes; no NUL. HEAD fixtures have an empty body." }
        }
      }
    },
    "themes": {
      "type": "array",
      "maxItems": 16,
      "default": [],
      "description": "App-theme documents offered to the host's theme library while the extension is installed (disabling it keeps them; removal or an invalid package withdraws them). Requires the appearance.themes capability. Each resource is a package-relative JSON file in the host's app-theme vocabulary (the document Threading stores for a custom theme); the host reads, validates, and namespaces it (ext.<extension>.<id>) at inspection time, before any extension code runs.",
      "items": {
        "type": "object",
        "additionalProperties": false,
        "required": ["id", "resource"],
        "properties": {
          "id": { "$ref": "#/$defs/contributionIdentifier" },
          "resource": {
            "type": "string",
            "minLength": 1,
            "description": "Package-relative path without '.' or '..' components."
          }
        }
      }
    },
    "componentThemeScope": {
      "type": "string",
      "enum": ["always", "ownThemes"],
      "default": "always",
      "description": "A binding floor for every component patch the extension publishes. 'ownThemes' applies them only while the selected app theme is one this extension contributes under 'themes' (a Duplicate to Edit copy is a custom theme and does not count), and is shown in the install review. Requires at least one theme and the ui.components or appearance.session-identity capability. A patch cannot widen it. Omit for 'always'."
    },
    "fonts": {
      "type": "array",
      "maxItems": 16,
      "default": [],
      "description": "Font files (.otf, .ttf, .ttc) registered process-scoped for Threading's own chrome while the extension is installed (disabling it keeps them; removal or an invalid package withdraws them). Requires the appearance.fonts capability. Family names come from the files themselves; the host parses each file at inspection time and names every family in the install disclosure. Licensing of a bundled font is the package author's responsibility.",
      "items": {
        "type": "object",
        "additionalProperties": false,
        "required": ["resource"],
        "properties": {
          "resource": {
            "type": "string",
            "minLength": 1,
            "description": "Package-relative path ending in .otf, .ttf, or .ttc."
          }
        }
      }
    },
    "localizations": {
      "type": "array",
      "maxItems": 16,
      "default": [],
      "description": "Optional package-owned translation tables. Each resource is a flat JSON object mapping base-language presentation strings to translations. The host negotiates against the user's preferred languages, localizes host-rendered contributions, and supplies the same selected table to the extension process.",
      "items": {
        "type": "object",
        "additionalProperties": false,
        "required": ["locale", "resource"],
        "properties": {
          "locale": {
            "type": "string",
            "pattern": "^[A-Za-z]{2,8}(-[A-Za-z0-9]{1,8})*$"
          },
          "resource": {
            "type": "string",
            "minLength": 1,
            "pattern": "^(?!/)(?!.*(?:^|/)\\.\\.?/).+\\.json$"
          }
        }
      }
    }
  },
  "$defs": {
    "contributionIdentifier": {
      "type": "string",
      "pattern": "^[a-z][a-z0-9.-]*$"
    },
    "mcpTool": {
      "type": "object",
      "additionalProperties": false,
      "required": ["id", "title", "description", "inputSchema"],
      "properties": {
        "id": { "$ref": "#/$defs/contributionIdentifier" },
        "title": { "type": "string", "minLength": 1, "maxLength": 120 },
        "description": { "type": "string", "minLength": 1, "maxLength": 500 },
        "inputSchema": {
          "type": "object",
          "required": ["type"],
          "properties": {
            "type": { "const": "object" }
          }
        }
      }
    },
    "companion": {
      "type": "object",
      "additionalProperties": false,
      "required": ["id", "platform", "bundlePath", "capabilities"],
      "properties": {
        "id": {
          "$ref": "#/$defs/contributionIdentifier"
        },
        "platform": {
          "const": "macOS"
        },
        "bundlePath": {
          "type": "string",
          "minLength": 1,
          "pattern": "^[^/].*\\.app$",
          "description": "Package-relative path to a nested app. The host rejects absolute paths, '.', '..', symlink escapes, malformed bundles, and mismatched derived bundle identifiers."
        },
        "activation": {
          "type": "string",
          "enum": ["onDemand", "whileExtensionEnabled"],
          "default": "onDemand"
        },
        "capabilities": {
          "type": "array",
          "maxItems": 32,
          "uniqueItems": true,
          "description": "OS-facing companion authority, independently approved from the WebAssembly core's Threading host capabilities. SDK v1 values are background.service, process.spawn, network.client, network.listen, filesystem.user-selected.read, filesystem.user-selected.write, screen.capture, input.control, automation.apple-events, notifications.post, clipboard.read, clipboard.write, and ui.remote-surfaces.",
          "items": {
            "type": "string",
            "minLength": 1
          }
        },
        "operations": {
          "type": "array",
          "maxItems": 64,
          "default": [],
          "description": "Named, schema-described operations the WebAssembly core may invoke through Threading's host broker. Declaring any operation requires the core capability companions.invoke.",
          "items": {
            "$ref": "#/$defs/companionOperation"
          }
        },
        "surfaces": {
          "type": "array",
          "maxItems": 16,
          "default": [],
          "description": "Bounded pixel surfaces rendered by this companion into host-owned views. Declaring any surface requires the companion capability ui.remote-surfaces.",
          "items": {
            "$ref": "#/$defs/remoteSurface"
          }
        }
      }
    },
    "companionOperation": {
      "type": "object",
      "additionalProperties": false,
      "required": ["id", "title", "description", "inputSchema", "outputSchema"],
      "properties": {
        "id": { "$ref": "#/$defs/contributionIdentifier" },
        "title": { "type": "string", "minLength": 1, "maxLength": 120 },
        "description": { "type": "string", "minLength": 1, "maxLength": 500 },
        "inputSchema": {
          "type": "object",
          "required": ["type"],
          "properties": {
            "type": { "const": "object" }
          }
        },
        "outputSchema": {
          "type": "object"
        }
      }
    },
    "remoteSurface": {
      "type": "object",
      "additionalProperties": false,
      "required": ["id", "title", "accessibilityLabel"],
      "properties": {
        "id": { "$ref": "#/$defs/contributionIdentifier" },
        "title": { "type": "string", "minLength": 1, "maxLength": 120 },
        "accessibilityLabel": {
          "type": "string",
          "minLength": 1,
          "maxLength": 240,
          "description": "Host-owned accessibility fallback for the pixel surface."
        },
        "maximumWidth": {
          "type": "integer",
          "minimum": 1,
          "maximum": 4096,
          "default": 2560
        },
        "maximumHeight": {
          "type": "integer",
          "minimum": 1,
          "maximum": 4096,
          "default": 1600
        },
        "acceptsPointer": { "type": "boolean", "default": false },
        "acceptsKeyboard": { "type": "boolean", "default": false }
      }
    }
  }
}
