{
  "formatVersion": 1,
  "identifier": "codes.threading.session-info",
  "name": "Session Info",
  "version": "0.1.0",
  "runtime": "webAssembly",
  "executable": "bin/session-info.wasm",
  "capabilities": [
    "panels",
    "host.projects.read",
    "host.sessions.read",
    "host.sessions.runtime.read",
    "host.repositories.read"
  ],
  "mcpTools": [],
  "services": [],
  "serviceDependencies": []
}
